segment,from,to,Speaker,text
826,0:37:42,0:37:45,,你怎麼看李正浩他揭露說
827,0:37:45,0:37:49,,今年10月13號交通大學統戰部辦了一個統戰音樂會
828,0:37:49,0:37:52,,那裡面出席包括有上海市台辦的副主任
829,0:37:52,0:37:55,,跟他們的統戰部的部長
830,0:37:55,0:37:59,,然後他說他本質上就是中國統戰部的旗子
831,0:37:59,0:38:01,,你怎麼看李正浩的一個說法
832,0:38:01,0:38:06,柯文哲,我對李正浩不熟
833,0:38:06,0:38:09,,對他講的話更不熟
834,0:38:09,0:38:10,,所以好像
835,0:38:10,0:38:13,,你這樣突然問我我也不知道什麼意思
836,0:38:13,0:38:15,,我跟他講
837,0:38:15,0:38:18,,如果每個人每個名嘴講的話
838,0:38:18,0:38:19,,我都要去查證
839,0:38:19,0:38:20,,要去那個
840,0:38:20,0:38:24,,我再告訴你我大概晚上到3點都還不用睡覺
841,0:38:25,0:38:26,主持人,好
842,0:38:26,0:38:32,,感謝大家今天來參與我們的搶救少子化十全大補湯的記者會
843,0:38:32,0:38:33,,那麼今天呢
844,0:38:33,0:38:37,,柯文哲總統參選人他具體提出了十大補湯
845,0:38:37,0:38:40,,希望能夠有善生養的環境
846,0:38:40,0:38:42,,來搶救少子化的危機
847,0:38:42,0:38:46,,相關的內容也歡迎大家到我們的柯文哲的競選官網
848,0:38:46,0:38:49,,還有訂閱柯文哲的官方LINE頻道
849,0:38:49,0:38:51,,我們有更多的訊息會傳送給大家
850,0:38:51,0:38:53,,謝謝大家今天參與