segment,from,to,text
1,00:00:00.000,00:00:03.600,歡迎各位貴賓來參與我們的記者會
2,00:00:03.600,00:00:04.560,還有總幹事
3,00:00:04.560,00:00:05.920,歡迎大家先就座
4,00:00:05.920,00:00:07.760,記者會即將正式的開始
5,00:00:07.760,00:00:12.080,各位貴賓
6,00:00:12.080,00:00:13.680,還有我們的媒體好朋友們
7,00:00:13.680,00:00:15.960,以及收看直播各位觀眾朋友們
8,00:00:15.960,00:00:17.280,大家早安
9,00:00:17.280,00:00:19.000,歡迎來到國家希望工程
10,00:00:19.000,00:00:21.280,國政願景的記者會現場
11,00:00:21.280,00:00:24.720,這是我們這個系列第四次開記者會了
12,00:00:24.720,00:00:28.320,今天的主題是創新經濟智慧國家
13,00:00:28.320,00:00:31.040,主要以創新作為驅動引擎
14,00:00:31.040,00:00:32.680,那麼在記者會的一開始
15,00:00:32.680,00:00:35.120,先為大家來介紹監與會的貴賓
16,00:00:35.120,00:00:38.000,首先第一位賴清德總統參選人
17,00:00:38.000,00:00:40.000,早安
18,00:00:40.000,00:00:43.520,以及競總的國政召集人
19,00:00:43.520,00:00:45.960,暨清平台的董事長鄭麗君
20,00:00:45.960,00:00:47.440,歡迎麗君召集人
21,00:00:47.440,00:00:48.680,早安
22,00:00:48.680,00:00:50.680,以及第三位是清平台的顧問
23,00:00:50.680,00:00:52.040,朱敬儀院士
24,00:00:52.040,00:00:53.840,歡迎朱顧問
25,00:00:53.840,00:00:54.560,早安
26,00:00:54.560,00:00:56.320,以及新興界文教基金會
27,00:00:56.320,00:00:58.560,陳鎮然董事 董事好
28,00:00:58.560,00:01:00.480,歡迎董事麗玲
29,00:01:00.480,00:01:02.880,以及台灣大學財政金融系的
30,00:01:02.880,00:01:04.160,施拜達教授
31,00:01:04.160,00:01:05.520,教授好
32,00:01:05.520,00:01:06.400,歡迎您
33,00:01:06.400,00:01:09.360,台灣智庫呂耀智執行長
34,00:01:09.360,00:01:11.360,執行長早安
35,00:01:11.360,00:01:12.480,在記者會的一開始
36,00:01:12.480,00:01:14.280,邀請賴副總統為大家介紹
37,00:01:14.280,00:01:17.080,今天主題的國政願景
38,00:01:17.080,00:01:19.600,掌聲歡迎賴清德總統參選人
39,00:01:19.600,00:01:25.400,好 謝謝
40,00:01:26.400,00:01:29.960,京權總部國政南途召集人
41,00:01:29.960,00:01:31.640,鄭麗君董事長
42,00:01:31.640,00:01:35.160,大家所尊敬的朱敬儀院士
43,00:01:35.160,00:01:36.680,陳鎮然理事長
44,00:01:36.680,00:01:37.880,施拜達教授
45,00:01:37.880,00:01:39.480,以及呂耀智教授
46,00:01:39.480,00:01:41.480,在場美女朋友
47,00:01:41.480,00:01:45.000,以及線上收聽直播的國人同胞
48,00:01:45.000,00:01:47.000,大家早安 大家好
49,00:01:47.000,00:01:49.480,在未來
50,00:01:49.480,00:01:53.400,我將秉持民進黨青年勤政
51,00:01:53.400,00:01:54.920,愛鄉土的精神
52,00:01:54.920,00:02:01.480,以及愛和平非暴力的創黨價值
53,00:02:01.480,00:02:04.440,結合台灣社會各界的力量
54,00:02:04.440,00:02:08.680,用人為財推動國家希望工程
55,00:02:08.680,00:02:12.520,打造民主和平的台灣
56,00:02:12.520,00:02:15.720,創新繁榮的台灣
57,00:02:15.720,00:02:19.560,以及公益永續的台灣
58,00:02:19.560,00:02:21.800,在今天的記者會
59,00:02:21.800,00:02:25.000,我將用創新經濟
60,00:02:25.000,00:02:30.040,以及智慧國家的理念
61,00:02:30.040,00:02:37.080,進一步的闡述創新繁榮台灣的內涵
62,00:02:37.080,00:02:40.360,各位國人同胞
63,00:02:40.360,00:02:44.760,世界的局勢正在劇烈的變化
64,00:02:44.760,00:02:47.400,因為疫情的衝擊
65,00:02:47.400,00:02:51.080,影響了全世界的社會行為
66,00:02:51.080,00:02:55.160,也影響了經濟跟產業的結構
67,00:02:55.160,00:02:57.480,地緣政治的變化
68,00:02:57.480,00:02:59.640,包括中美科技戰
69,00:02:59.640,00:03:01.640,二烏戰爭
70,00:03:01.640,00:03:05.720,以及台海情勢的升高
71,00:03:05.720,00:03:09.400,都影響了整個國際社會
72,00:03:09.400,00:03:13.480,另外再加上數位轉型
73,00:03:13.480,00:03:19.240,以及面臨的2050淨零轉型的挑戰
74,00:03:19.240,00:03:23.080,整個國際局勢的劇烈變化當中
75,00:03:23.080,00:03:26.200,台灣受到衝擊受到影響
76,00:03:26.200,00:03:28.200,自然也不例外
77,00:03:28.200,00:03:29.720,在這種狀況之下
78,00:03:29.720,00:03:32.280,我們應該要團結一致
79,00:03:32.280,00:03:35.640,結合台灣社會各界的力量
80,00:03:35.640,00:03:41.240,將挑戰化為國家進步的動力
81,00:03:41.240,00:03:45.080,我今天所提出來的主題
82,00:03:45.080,00:03:47.640,主要就是創新經濟
83,00:03:47.640,00:03:51.160,以及智慧國家的理念
84,00:03:51.160,00:03:53.160,我們都很清楚
85,00:03:53.160,00:03:56.920,台灣的經濟是所有今天的進展
86,00:03:56.920,00:03:58.920,我們必須要感謝
87,00:03:58.920,00:04:02.360,成千上萬的中小企業組
88,00:04:02.360,00:04:05.480,在過去提著007的手提箱
89,00:04:05.480,00:04:08.760,到世界各地去爭取訂單
90,00:04:08.760,00:04:12.760,打造了第一次的經濟奇蹟
91,00:04:12.760,00:04:15.240,但是我們必須要講
92,00:04:15.240,00:04:18.840,在智慧化全新的時代
93,00:04:18.840,00:04:21.320,我們必須要走出過去
94,00:04:21.320,00:04:26.760,以生產要素為驅動的經濟發展模式
95,00:04:26.760,00:04:34.120,要改變用創新驅動的經濟發展的方式
96,00:04:34.120,00:04:40.280,所謂經濟創新驅動的經濟發展模式
97,00:04:40.280,00:04:43.720,主要有包括四個面向
98,00:04:43.720,00:04:46.280,第一個是產業創新
99,00:04:46.280,00:04:49.480,第二個是科技創新
100,00:04:49.480,00:04:52.680,第三個是金融創新
101,00:04:52.680,00:04:56.280,第四個面向則是創新創業
102,00:04:56.280,00:04:59.720,我們要因此達到三個目標
103,00:04:59.720,00:05:03.560,也就是創新成長的目標
104,00:05:03.560,00:05:06.760,包容性成長的目標
105,00:05:06.760,00:05:10.280,以及綠色成長的目標
106,00:05:10.280,00:05:15.080,以下我將會用七項主張
107,00:05:15.080,00:05:20.680,來進一步闡述所有的理念跟做法
108,00:05:20.680,00:05:23.080,第一個主張就是
109,00:05:23.080,00:05:27.560,提升產業的國際競爭力與韌性
110,00:05:27.560,00:05:31.880,讓台灣成為經濟的日不落國
111,00:05:31.880,00:05:37.560,具體的做法包括產業的面向
112,00:05:37.560,00:05:40.920,我們將持續推動蔡英文總統所提出的
113,00:05:40.920,00:05:43.960,六大核心戰略產業
114,00:05:43.960,00:05:46.760,因為這六大核心戰略產業
115,00:05:46.760,00:05:52.200,都是要因應當前國際的各項挑戰
116,00:05:52.200,00:05:55.480,所衍生出來的產業發展
117,00:05:55.480,00:05:58.280,好比在數位化的時代
118,00:05:58.280,00:06:01.000,我們要去推動
119,00:06:01.000,00:06:04.360,資訊數位核心戰略產業
120,00:06:04.360,00:06:09.960,以及資安卓越核心戰略產業
121,00:06:09.960,00:06:13.800,面對的2050近年轉型的要求
122,00:06:13.800,00:06:15.800,我們要去推動
123,00:06:15.800,00:06:21.400,綠電以及再生人員核心戰略產業
124,00:06:21.400,00:06:23.960,面對COVID-19的衝擊
125,00:06:23.960,00:06:27.960,以及未來可能下一波的
126,00:06:27.960,00:06:30.200,國際性的傳染病
127,00:06:30.200,00:06:36.600,我們要去推動精準醫療核心戰略產業
128,00:06:36.600,00:06:39.800,面對地緣政治的衝擊
129,00:06:39.800,00:06:42.360,極權主義的威脅
130,00:06:42.360,00:06:44.600,我們必須要去推動
131,00:06:44.600,00:06:49.400,民生戰備核心戰略產業
132,00:06:49.400,00:06:55.960,以及國防戰略核心戰略產業
133,00:06:55.960,00:06:57.480,六項核心戰略產業
134,00:06:57.480,00:06:59.560,我們必須要持續推動
135,00:06:59.560,00:07:03.640,另外一點是因為中美貿易衝突
136,00:07:03.640,00:07:06.200,再加上地緣政治的變化
137,00:07:06.200,00:07:09.480,中國的供應鏈受到嚴重的衝擊
138,00:07:09.480,00:07:16.120,也凸顯了台灣產業在全球供應鏈的重要性
139,00:07:16.120,00:07:19.720,這個是地緣政治的變化
140,00:07:19.720,00:07:23.720,提供了台灣產業進一步發展的機會
141,00:07:23.720,00:07:28.200,特別是其中五項信賴產業
142,00:07:28.200,00:07:31.080,第一個就是半導體產業
143,00:07:31.080,00:07:35.880,第二個就是人工智慧產業
144,00:07:35.880,00:07:40.280,第三個就是國防產業
145,00:07:40.280,00:07:45.640,第四個是軍工產業以及監控產業
146,00:07:45.640,00:07:50.040,第五個產業就是資通訊
147,00:07:50.040,00:07:53.160,特別是低軌衛星產業等等
148,00:07:53.160,00:07:57.880,這個都是未來台灣在地緣政治變化當中
149,00:07:57.880,00:08:01.000,我們要持續去加強
150,00:08:01.000,00:08:03.000,至於在布局方面
151,00:08:03.000,00:08:08.840,我們一定要讓台灣的企業能夠力主台灣
152,00:08:08.840,00:08:13.400,除了我們要持續去檢討台灣的投資環境
153,00:08:13.400,00:08:18.360,包括水電土地人力人才等等的
154,00:08:18.360,00:08:21.320,問題要持續檢討改善之外
155,00:08:21.320,00:08:23.880,我們也要持續去落實
156,00:08:23.880,00:08:27.240,之前我在行政院裡面所推動的
157,00:08:27.240,00:08:31.320,歡迎台商回台投資方案
158,00:08:31.320,00:08:36.840,鼓勵力主台灣的企業加碼投資台灣專案
159,00:08:36.840,00:08:41.880,還有支持中小企業投資台灣專案
160,00:08:41.880,00:08:45.800,以及進一步的去落實投資抵減
161,00:08:45.800,00:08:50.920,讓台灣這塊土地適合產業的發展
162,00:08:50.920,00:08:54.680,從而能夠讓台灣的企業能夠力主台灣
163,00:08:54.680,00:08:57.880,第二個做法是布局全球
164,00:08:57.880,00:09:02.360,這一兩年來台灣積極的跟印太國家
165,00:09:02.360,00:09:05.560,簽訂雙邊投資保障協定
166,00:09:05.560,00:09:07.560,包括跟菲律賓
167,00:09:07.560,00:09:09.320,包括跟越南
168,00:09:09.320,00:09:11.320,也包括跟印度
169,00:09:11.320,00:09:16.040,除了我們要持續的跟理念相同的國家
170,00:09:16.040,00:09:18.280,簽訂投資保障協定以外
171,00:09:18.280,00:09:20.760,我們也應該要進一步的
172,00:09:20.760,00:09:25.400,在印太地區去成立產業園區
173,00:09:25.400,00:09:27.400,方便我們的企業
174,00:09:27.400,00:09:31.000,如果要在印太去發展的話
175,00:09:31.000,00:09:33.640,他才有辦法有好的基地
176,00:09:33.640,00:09:35.640,得到好的幫助
177,00:09:35.640,00:09:39.640,去佈公司的發展
178,00:09:39.640,00:09:42.120,另外一個就是我們也要在
179,00:09:42.120,00:09:44.920,包括在日本
180,00:09:44.920,00:09:48.360,美國歐洲以及印太
181,00:09:48.360,00:09:51.560,去設立的
182,00:09:51.560,00:09:55.400,設立這個海外的創業中心
183,00:09:55.400,00:09:58.200,提供包括在金融
184,00:09:58.200,00:10:00.200,包括在法治
185,00:10:00.200,00:10:04.200,以及其他行政問題方面的協助
186,00:10:04.200,00:10:06.200,讓我們台灣的企業
187,00:10:06.200,00:10:09.000,可以順利的在全球布局
188,00:10:09.000,00:10:12.600,從而我們也要跟其他的國家
189,00:10:12.600,00:10:15.240,去簽訂雙邊
190,00:10:15.240,00:10:17.960,或是多邊的貿易協定
191,00:10:17.960,00:10:19.960,讓我們的產業可以
192,00:10:19.960,00:10:21.960,產品可以行銷全世界
193,00:10:21.960,00:10:24.760,我想最顯著的例子就是
194,00:10:24.760,00:10:26.760,之前我們跟台美
195,00:10:26.760,00:10:29.320,簽訂21世紀貿易倡議
196,00:10:29.320,00:10:32.040,我們也成功的跟英國簽訂了
197,00:10:32.040,00:10:37.960,深化兩國經貿的夥伴關係
198,00:10:37.960,00:10:39.960,目前台灣也正積極
199,00:10:39.960,00:10:41.960,跟理念相近的國家
200,00:10:41.960,00:10:45.960,在簽訂類似的貿易協定
201,00:10:45.960,00:10:48.520,另外我們也必須要加入區域經濟
202,00:10:48.520,00:10:53.320,台灣已經提出申請加入CPTPP等等
203,00:10:53.320,00:10:55.960,我們用這樣的布局
204,00:10:55.960,00:10:59.000,才有可能讓台灣的企業
205,00:10:59.000,00:11:00.760,所生產的產品
206,00:11:00.760,00:11:03.240,可以行銷全世界不至於受到
207,00:11:03.240,00:11:05.240,關稅等面向的影響
208,00:11:05.240,00:11:07.240,我衷心期盼
209,00:11:07.240,00:11:09.240,我也希望我們國人大家努力
210,00:11:09.240,00:11:11.240,讓台灣成為
211,00:11:11.240,00:11:13.240,經濟上的日不落國
212,00:11:13.240,00:11:15.240,不管太陽在什麼地方
213,00:11:15.240,00:11:17.240,在什麼時候申請
214,00:11:17.240,00:11:21.240,都可以照耀到本國企業
215,00:11:21.240,00:11:25.240,這個就是在產業創新以及國際布局上面
216,00:11:25.240,00:11:27.240,我們必須要去做的目標
217,00:11:27.240,00:11:29.240,第二個我們是談到
218,00:11:29.240,00:11:31.240,科技創新
219,00:11:31.240,00:11:33.240,我們希望用科技創新
220,00:11:33.240,00:11:37.240,打造台灣成為智慧科技島
221,00:11:37.240,00:11:39.240,有幾個具體的做法
222,00:11:39.240,00:11:43.240,包括強化半導體國家級戰略
223,00:11:43.240,00:11:45.240,台灣的半導體
224,00:11:45.240,00:11:49.240,實力是為國際社會所呈現的
225,00:11:49.240,00:11:51.240,我們的IC設計
226,00:11:51.240,00:11:55.240,我們的產值占全球的24%左右
227,00:11:55.240,00:11:57.240,市占率
228,00:11:57.240,00:12:01.240,我們的晶圓製造
229,00:12:01.240,00:12:03.240,市占率大概占六成幾
230,00:12:03.240,00:12:05.240,百分之六十幾
231,00:12:05.240,00:12:07.240,我們的封裝測試也占到
232,00:12:07.240,00:12:09.240,百分之五十幾將近百分之六十
233,00:12:09.240,00:12:11.240,這些都是非常難得的成績
234,00:12:11.240,00:12:13.240,特別是先進製程
235,00:12:13.240,00:12:15.240,我們市占
236,00:12:15.240,00:12:17.240,占有百分之九十以上
237,00:12:17.240,00:12:19.240,未來我們應該要持續擴大
238,00:12:19.240,00:12:23.240,我們台灣半導體產業
239,00:12:23.240,00:12:25.240,在國際社會上領先的地位
240,00:12:25.240,00:12:29.240,從而能夠帶動其他科技
241,00:12:29.240,00:12:31.240,還有傳統產業的發展
242,00:12:31.240,00:12:35.240,另外一部分就是我們要促進AI產業化
243,00:12:35.240,00:12:37.240,以及產業AI化
244,00:12:37.240,00:12:39.240,我在行政院的時候曾經提出
245,00:12:39.240,00:12:43.240,人工智慧行動方案
246,00:12:43.240,00:12:45.240,具體的做法包括
247,00:12:45.240,00:12:47.240,人才
248,00:12:47.240,00:12:51.240,人才的培育計畫
249,00:12:51.240,00:12:55.240,另外也善用我們台灣的半導體產業
250,00:12:55.240,00:12:57.240,然後軟硬體共同合作
251,00:12:57.240,00:13:01.240,去推動人工智慧的發展
252,00:13:01.240,00:13:03.240,第三個也進一步的去鬆綁法令
253,00:13:03.240,00:13:05.240,建置試驗的場域
254,00:13:05.240,00:13:07.240,第四個是希望台灣能夠成為
255,00:13:07.240,00:13:11.240,人工智慧發展的國際樞紐
256,00:13:11.240,00:13:15.240,讓國際級的公司能夠在台灣成立
257,00:13:15.240,00:13:17.240,人工智慧的研發中心
258,00:13:17.240,00:13:19.240,這一部分都已經陸續達到
259,00:13:19.240,00:13:23.240,未來我們希望讓人工智慧
260,00:13:23.240,00:13:25.240,在台灣產業化之後
261,00:13:25.240,00:13:29.240,讓台灣成為人工智慧的國際樞紐之下
262,00:13:29.240,00:13:33.240,再用人工智慧協助台灣的中小企業
263,00:13:33.240,00:13:37.240,讓台灣的產業也能夠人工智慧化
264,00:13:37.240,00:13:39.240,另外為了要達到這幾個目標
265,00:13:39.240,00:13:41.240,我們必須要打造四個平台
266,00:13:41.240,00:13:45.240,第一個是前瞻科技研發平台
267,00:13:45.240,00:13:49.240,全面智慧化的時代已經來臨
268,00:13:49.240,00:13:51.240,台灣必須要勇敢的
269,00:13:51.240,00:13:57.240,前瞻的積極的投資下一代的科技創新
270,00:13:57.240,00:13:59.240,這除了包括半導體
271,00:13:59.240,00:14:01.240,人工智慧以外
272,00:14:01.240,00:14:04.240,還有包括量子電腦
273,00:14:04.240,00:14:07.240,低軌道衛星 太空科技
274,00:14:07.240,00:14:12.240,甚至於精準健康產業等等
275,00:14:12.240,00:14:16.240,這些我們必須要在這個當下
276,00:14:16.240,00:14:21.240,就必須要決定未來下一代發展的投資
277,00:14:21.240,00:14:27.240,另外一個就是打造淨零的創新科技平台
278,00:14:27.240,00:14:30.240,蔡總統在2021年的4月22號
279,00:14:30.240,00:14:33.240,世界地球日已經接觸了台灣
280,00:14:33.240,00:14:36.240,2050淨零碳排的目標
281,00:14:36.240,00:14:39.240,跟國際社會是一樣的
282,00:14:39.240,00:14:45.240,在2022年3月份行政院蘇院長也提出了
283,00:14:45.240,00:14:49.240,邁向2050淨零碳排的路徑圖
284,00:14:49.240,00:14:51.240,預計在2030年之前
285,00:14:51.240,00:14:54.240,台灣將投資9000億新台幣
286,00:14:54.240,00:14:59.240,帶動民間的投資一起邁向
287,00:14:59.240,00:15:01.240,淨零轉型的目標
288,00:15:01.240,00:15:02.240,在這種狀況之下
289,00:15:02.240,00:15:05.240,我們必須要成立一個平台
290,00:15:05.240,00:15:07.240,讓科技能夠創新
291,00:15:07.240,00:15:09.240,也經由創新的科技
292,00:15:09.240,00:15:11.240,協助台灣 協助國際社會
293,00:15:11.240,00:15:15.240,能夠逐步的達到2050淨零轉型的目標
294,00:15:15.240,00:15:18.240,第三個平台是人文社會科學及
295,00:15:18.240,00:15:21.240,跨領域的科技研究平台
296,00:15:21.240,00:15:24.240,科技非常重要
297,00:15:24.240,00:15:27.240,但科技不外乎人性
298,00:15:27.240,00:15:28.240,在這種狀況之下
299,00:15:28.240,00:15:33.240,人文社會科學的發展是非常重要的
300,00:15:33.240,00:15:34.240,換句話說
301,00:15:34.240,00:15:37.240,我們是希望在科技的發展當中
302,00:15:37.240,00:15:39.240,能夠以人為本
303,00:15:39.240,00:15:41.240,社會才有可能和諧
304,00:15:41.240,00:15:46.240,另外第四個平台是軟硬體的研發平台
305,00:15:46.240,00:15:50.240,讓未來台灣過去重視硬體
306,00:15:50.240,00:15:52.240,未來也能夠重視軟體
307,00:15:52.240,00:15:56.240,軟硬體吸手才是台灣未來科技發展
308,00:15:56.240,00:15:59.240,產業創新的必要之路
309,00:15:59.240,00:16:02.240,另外一點就是我們也鼓勵女性
310,00:16:02.240,00:16:05.240,能夠多多投入Stan的領域
311,00:16:05.240,00:16:07.240,因為女性的力量
312,00:16:07.240,00:16:11.240,對整個國家發展的重要性是不言可喻的
313,00:16:11.240,00:16:14.240,另外一個第三個主張是
314,00:16:14.240,00:16:17.240,我重新再把以人為本這樣的理念
315,00:16:17.240,00:16:20.240,再把它拿出來再來強調
316,00:16:20.240,00:16:21.240,換句話說
317,00:16:21.240,00:16:23.240,我們在用科技創新
318,00:16:23.240,00:16:26.240,要打造智慧國家的同時
319,00:16:26.240,00:16:30.240,也希望建構以人為本的智慧新社會
320,00:16:30.240,00:16:32.240,這總共有五個面向
321,00:16:32.240,00:16:35.240,第一個就是以人和社會
322,00:16:35.240,00:16:38.240,作為數位科技發展的對象
323,00:16:38.240,00:16:43.240,科技是要解決人生活的問題
324,00:16:43.240,00:16:47.240,科技社會也希望能夠帶動社會的和諧發展
325,00:16:47.240,00:16:49.240,因此在這種狀況之下
326,00:16:49.240,00:16:54.240,我們科技的發展應該優先考量民眾的需要
327,00:16:54.240,00:16:57.240,還有社會的需求來帶動
328,00:16:57.240,00:16:59.240,第二點就是消除
329,00:16:59.240,00:17:02.240,積極消除數位落差
330,00:17:02.240,00:17:04.240,我們不希望
331,00:17:04.240,00:17:08.240,因為科技的發展或是數位的進步
332,00:17:08.240,00:17:12.240,卻是進一步的帶動城鄉的差距
333,00:17:12.240,00:17:14.240,或者是貧富的差距
334,00:17:14.240,00:17:16.240,我們希望科技在發展的同時
335,00:17:16.240,00:17:20.240,我們也能夠兼顧消除數位落差
336,00:17:20.240,00:17:22.240,第三個是全面優化
337,00:17:22.240,00:17:25.240,政府數位公共服務
338,00:17:25.240,00:17:29.240,民間發展的動能很強
339,00:17:29.240,00:17:33.240,政府絕對不能夠落後
340,00:17:33.240,00:17:36.240,我們要打造全面性的智慧國家
341,00:17:36.240,00:17:39.240,或是科技創新的社會
342,00:17:39.240,00:17:42.240,政府扮演的關鍵的角色
343,00:17:42.240,00:17:43.240,在這種狀況之下
344,00:17:43.240,00:17:47.240,政府除了必須要公開透明
345,00:17:47.240,00:17:50.240,成為一個開放政府以外
346,00:17:50.240,00:17:55.240,特別也必須要有人工智慧化的政府
347,00:17:55.240,00:17:58.240,公務人員應該有計畫的
348,00:17:58.240,00:18:01.240,逐批接受人工教育的
349,00:18:01.240,00:18:05.240,人工智慧的專業的知識
350,00:18:05.240,00:18:09.240,也只有政府能夠全面性的人工智慧化
351,00:18:09.240,00:18:12.240,在推動社會人工智慧發展
352,00:18:12.240,00:18:15.240,帶動國家 智慧國家
353,00:18:15.240,00:18:18.240,才有可能事半功倍
354,00:18:18.240,00:18:22.240,另外一個就是創造社會的
355,00:18:22.240,00:18:27.240,也就是說我們希望在廣泛的
356,00:18:27.240,00:18:31.240,將人工智慧或是新興科技
357,00:18:31.240,00:18:34.240,導向教育 醫療 交通
358,00:18:34.240,00:18:36.240,環境等公共議題上面
359,00:18:36.240,00:18:39.240,能夠帶動社會進步
360,00:18:39.240,00:18:41.240,以及人民的福祉
361,00:18:41.240,00:18:45.240,那第五個是建立數位民主的新典範
362,00:18:45.240,00:18:48.240,民主 民主 人民做主
363,00:18:48.240,00:18:50.240,人民是國家的主人
364,00:18:50.240,00:18:54.240,因此國家在推動建置智慧國家
365,00:18:54.240,00:18:57.240,全面數位化的社會時代的時候
366,00:18:57.240,00:18:59.240,每一個人都有權利
367,00:18:59.240,00:19:01.240,每一個人也都享有
368,00:19:01.240,00:19:04.240,政府應要給予的機會
369,00:19:04.240,00:19:07.240,去接觸數位科技
370,00:19:07.240,00:19:11.240,不因為它的階層而有所不同
371,00:19:11.240,00:19:15.240,也不因為它所生長住在的區域
372,00:19:15.240,00:19:16.240,而有所不同
373,00:19:16.240,00:19:19.240,這個是我們堅持的理念
374,00:19:19.240,00:19:21.240,另外一個第四個主張是
375,00:19:21.240,00:19:24.240,推動金融創新與發展
376,00:19:24.240,00:19:26.240,第一個做法是引導資金
377,00:19:26.240,00:19:28.240,支持國家建設
378,00:19:28.240,00:19:31.240,我們都很清楚幾十年來
379,00:19:31.240,00:19:33.240,全體國人的努力
380,00:19:33.240,00:19:36.240,台灣已經累積相當的財富
381,00:19:36.240,00:19:39.240,目前金融單位所擁有的資金
382,00:19:39.240,00:19:43.240,高達六十幾億 六十幾兆之多
383,00:19:43.240,00:19:46.240,保險公司所管理的保險費
384,00:19:46.240,00:19:49.240,也高達三十幾兆之多
385,00:19:49.240,00:19:52.240,我們應該要有效率的
386,00:19:52.240,00:19:56.240,有目標性的 有計畫的
387,00:19:56.240,00:20:00.240,將國人幾十年來所累積的資金
388,00:20:00.240,00:20:03.240,引導到國家的公共建設上面
389,00:20:03.240,00:20:05.240,創造國家的進步
390,00:20:05.240,00:20:08.240,也進一步的帶動社會的繁榮
391,00:20:08.240,00:20:11.240,幾個面向 包括長照
392,00:20:11.240,00:20:13.240,社會住宅 都市更新
393,00:20:13.240,00:20:17.240,還有其他許多的公共建設等等
394,00:20:17.240,00:20:21.240,另外金融也必須要有創新
395,00:20:21.240,00:20:24.240,我們必須要提供 我們必須要鬆綁法令
396,00:20:24.240,00:20:27.240,甚至於建設新的法案
397,00:20:27.240,00:20:30.240,提供金融沙盒
398,00:20:30.240,00:20:33.240,讓金融業有可以科技創新的機會
399,00:20:33.240,00:20:37.240,提供更好 更多 更有效率的服務
400,00:20:37.240,00:20:42.240,讓這個金融的發展能夠更加的多元
401,00:20:42.240,00:20:45.240,也因此而強化其他產業的發展
402,00:20:45.240,00:20:49.240,那當然金融業另外還有一個重要的角色
403,00:20:49.240,00:20:51.240,就是綠色金融
404,00:20:51.240,00:20:54.240,協助台灣廣大的中小企業
405,00:20:54.240,00:20:57.240,也能夠注重ESG的發展
406,00:20:57.240,00:21:01.240,除了本身金融業要注重ESG的發展
407,00:21:01.240,00:21:06.240,也能夠透過綠色金融協助台灣的產業
408,00:21:06.240,00:21:11.240,往ESG國家永續發展目標來邁進
409,00:21:11.240,00:21:14.240,那第四個就是普惠金融
410,00:21:14.240,00:21:19.240,金融的服務也是人民的一項權利
411,00:21:19.240,00:21:22.240,這部分我們會持續來推動 來加強
412,00:21:22.240,00:21:27.240,那第五項主張就是創新創業的部分
413,00:21:27.240,00:21:30.240,在這裡我們希望未來能夠打造
414,00:21:30.240,00:21:34.240,創新創業的雨林生態系
415,00:21:34.240,00:21:36.240,過去我在行政院長任內
416,00:21:36.240,00:21:42.240,也曾經推出優化創新創業的環境的這個方案
417,00:21:42.240,00:21:45.240,那未來我們會持續來落實加強
418,00:21:45.240,00:21:47.240,我們設定了一個目標
419,00:21:47.240,00:21:52.240,五年內要創造兩萬個新創就業
420,00:21:52.240,00:21:57.240,新創投資金額每一年能夠達到1500億元
421,00:21:57.240,00:22:03.240,十年內讓台灣成為創新解決方案的淨輸出國
422,00:22:03.240,00:22:08.240,具體的做法包括優化創新創業生態系
423,00:22:08.240,00:22:12.240,落實法規調適 增加投資力道
424,00:22:12.240,00:22:16.240,擴大國際新創聚落等等持續來推動
425,00:22:16.240,00:22:19.240,第二個也開創新創的國際視野
